
2;Budget Feminine Green 2;["60f6423e8947a20489a96072","60f6423e8947a20489a9607f"];read/526e9d01-592f-44c9-9669-8b9d812e731a_TEN2_sample_210224;18;60cabc8327a131004cceb1ac;Ignorant Rotten Euphoric Present Station Defiant Fire Other Common Cup Assistance Solid Street Impact Salary Car Appearance Height Tidy Pristine Crushing Storm Field List Peace Pure Well-off Cooked Guilty Ringed Suburban Scrawny Baggy Miserly Lumbering Attached Occasional 2;60cabc7f27a131004cceabd6;https://nftjapan.s3.ap-southeast-1.amazonaws.com/image/a284ee5c-2323-4a50-86e9-54ff155d7d30-AriumWeb1x1.011.png;6;60cabc8c27a131004ccec0bb;0;Tue Jul 20 2021 03:46:49 GMT+0700 (Indochina Time);85386
6;Feisty 6;["60f6423e8947a20489a96072","60f6423e8947a20489a9607f"];read/0401ed50-7505-4b79-9b41-527e0745a4c6_TEN1_sample_210224;21;60cabc8327a131004cceb1ad;Angle Gentle Caring Employer Tinted Insistent Extraneous Regret Go Health Sorrowful Mind School Marvelous Classic Sardonic Live Bold Other Satisfaction 6;60cabc7f27a131004cceabd6;https://nftjapan.s3.ap-southeast-1.amazonaws.com/image/17a0393f-bbff-494a-bb7d-e32f36413ced-AriumWeb1x1.031.png;8;60cabc8c27a131004ccec0bb;15;Mon Jul 19 2021 13:12:44 GMT+0700 (Indochina Time);77707
10;10;["60f6423e8947a20489a96072","60f6423e8947a20489a9607f"];read/d3c14d48-c040-455e-b2df-63cf9c6f46c0_TEN0_sample_210224;6;60cabc8327a131004cceb1ae;Treasured Doctor Promotion Unhappy Unwitting Delicious Competent Hour Sardonic Rule Management Relieved Granular Condition Muddy Unhealthy Flimsy Dimpled Method Necessary Third Breakfast Jumbo Period Weather Variation Careful Title Tidy Lazy 10;60cabc7f27a131004cceabd6;https://nftjapan.s3.ap-southeast-1.amazonaws.com/image/2cc26488-faf9-43fc-9214-da6fb8cf71b1-ep1.png;9;60cabc8c27a131004ccec0bb;0;Mon Jul 19 2021 08:52:00 GMT+0700 (Indochina Time);5174005
14;Ecstatic Tooth Steep Harm 14;["60f6423e8947a20489a96072","60f6423e8947a20489a9607f"];read/526e9d01-592f-44c9-9669-8b9d812e731a_TEN2_sample_210224;18;60cabc8327a131004cceb1af;Work Maintenance Method Alert Extent Fake Easy Quaint Yawning Maintenance Comfortable Wet International Thrifty Platform Sophisticated Prompt Defenseless Elliptical Currency 14;60cabc7f27a131004cceabd6;https://nftjapan.s3.ap-southeast-1.amazonaws.com/image/a284ee5c-2323-4a50-86e9-54ff155d7d30-AriumWeb1x1.011.png;9;60cabc8c27a131004ccec0bb;43;Mon Jul 19 2021 17:10:40 GMT+0700 (Indochina Time);6570
18;Pull 18;["60f6423e8947a20489a96072","60f6423e8947a20489a9607f"];read/0401ed50-7505-4b79-9b41-527e0745a4c6_TEN1_sample_210224;21;60cabc8327a131004cceb1b0;Highlight Far-flung Tender Palatable Similar Steel Boiling Unwritten Antique Struggle Revolution Lopsided Teeming Tour Specialist Focused Tart Graceful Meaning Pass Cow Oddball Mobile Common Watery Impress Fine Fee Manager Elastic Mall Nasty Difference Gullible Screen 18;60cabc7f27a131004cceabd6;https://nftjapan.s3.ap-southeast-1.amazonaws.com/image/17a0393f-bbff-494a-bb7d-e32f36413ced-AriumWeb1x1.031.png;3;60cabc8c27a131004ccec0bb;0;Tue Jul 20 2021 03:02:01 GMT+0700 (Indochina Time);4053
22;Variation 22;["60f6423e8947a20489a96072","60f6423e8947a20489a9607f"];read/d3c14d48-c040-455e-b2df-63cf9c6f46c0_TEN0_sample_210224;6;60cabc8327a131004cceb1b1;Unwilling Humiliating Awesome Ornery Rain Nurse Star Spring Leafy Muddy Question Kosher Keen Evergreen Colorless Wiry Girlfriend Language Process Mountainous Set Acrobatic Championship 22;60cabc7f27a131004cceabd6;https://nftjapan.s3.ap-southeast-1.amazonaws.com/image/2cc26488-faf9-43fc-9214-da6fb8cf71b1-ep1.png;2;60cabc8c27a131004ccec0bb;71;Mon Jul 19 2021 12:53:33 GMT+0700 (Indochina Time);455885
26;Print Scared 26;["60f6423e8947a20489a96072","60f6423e8947a20489a9607f"];read/526e9d01-592f-44c9-9669-8b9d812e731a_TEN2_sample_210224;18;60cabc8327a131004cceb1b2;Outstanding Elastic Structure Section Illiterate Remarkable Protection Agonizing Happy Generous Giving Entire Playful Stable Nervous Unwitting Intentional Specialist Dental Joint Profitable Clock Capital Western Whispered Tomorrow Nautical Mine Frosty Reading Rowdy Tip Trainer Bad Wobbly Service Till Digital Run Increase Colorless International Photo 26;60cabc7f27a131004cceabd6;https://nftjapan.s3.ap-southeast-1.amazonaws.com/image/a284ee5c-2323-4a50-86e9-54ff155d7d30-AriumWeb1x1.011.png;4;60cabc8c27a131004ccec0bb;0;Tue Jul 20 2021 11:54:48 GMT+0700 (Indochina Time);34980
30;Tree 30;["60f6423e8947a20489a96072","60f6423e8947a20489a9607f"];read/0401ed50-7505-4b79-9b41-527e0745a4c6_TEN1_sample_210224;21;60cabc8327a131004cceb1b3;Change Ugly Overdue Knotty Upstairs Bear Employment Gifted Homework Wood Pastel Blow Bone Parched Camera Kid Rough Husband Elderly Cream Confidence Our Likable Neck Press Card Bewitched Try Shocking Previous Nose Character Drab Safe Popular Mundane Better Deep Speech Punctual 30;60cabc7f27a131004cceabd6;https://nftjapan.s3.ap-southeast-1.amazonaws.com/image/17a0393f-bbff-494a-bb7d-e32f36413ced-AriumWeb1x1.031.png;1;60cabc8c27a131004ccec0bb;93;Tue Jul 20 2021 03:32:19 GMT+0700 (Indochina Time);6181
34;Grade Deep 34;["60f6423e8947a20489a96072","60f6423e8947a20489a9607f"];read/d3c14d48-c040-455e-b2df-63cf9c6f46c0_TEN0_sample_210224;6;60cabc8327a131004cceb1b4;Previous Profuse Ajar Trained Gaseous Stupid Chief Paper Original Local Order Stretch Aggravating Giving Product Specific Recommendation Log Purchase Ambitious Grotesque Disgusting Document Foundation Language Measly Ambitious Figure Engine Dismal Heartfelt Adolescent Doubt Prize Rich Taste Foolish Interaction Average Glass Pure Equipment Opening Shower Session Medicine Murky 34;60cabc7f27a131004cceabd6;https://nftjapan.s3.ap-southeast-1.amazonaws.com/image/2cc26488-faf9-43fc-9214-da6fb8cf71b1-ep1.png;5;60cabc8c27a131004ccec0bb;0;Wed Jul 21 2021 04:47:19 GMT+0700 (Indochina Time);7899505
38;Shock Major Descriptive Head 38;["60f6423e8947a20489a96072","60f6423e8947a20489a9607f"];read/526e9d01-592f-44c9-9669-8b9d812e731a_TEN2_sample_210224;18;60cabc8327a131004cceb1b5;Automatic Evidence Shrill Access Employment Boat First Bewitched Adorable Breakfast Hungry Internal Shoulder Miserly Relief Impure Impartial Dual Salt Sample Rate Wake Branch Soulful Vital Doting Home Beautiful Purchase Lively Juicy Management Golf Baby Caring 38;60cabc7f27a131004cceabd6;https://nftjapan.s3.ap-southeast-1.amazonaws.com/image/a284ee5c-2323-4a50-86e9-54ff155d7d30-AriumWeb1x1.011.png;2;60cabc8c27a131004ccec0bb;47;Mon Jul 19 2021 11:27:16 GMT+0700 (Indochina Time);7781
42;Conclusion Flight Immediate Definition 42;["60f6423e8947a20489a96072","60f6423e8947a20489a9607f"];read/0401ed50-7505-4b79-9b41-527e0745a4c6_TEN1_sample_210224;21;60cabc8327a131004cceb1b6;Kiss Cultured Messy Quiet Untried Occasion Leading Kind Opulent Feature Embellished Conventional Background Bathroom Quarrelsome Chemical Swim Week Paltry Kooky Rush Adept Piano Grumpy Cigarette Cow Pointless Neat Area Prestigious Wicked Leave 42;60cabc7f27a131004cceabd6;https://nftjapan.s3.ap-southeast-1.amazonaws.com/image/17a0393f-bbff-494a-bb7d-e32f36413ced-AriumWeb1x1.031.png;4;60cabc8c27a131004ccec0bb;0;Mon Jul 19 2021 16:43:21 GMT+0700 (Indochina Time);32281
46;Quarterly Merry Activity 46;["60f6423e8947a20489a96072","60f6423e8947a20489a9607f"];read/d3c14d48-c040-455e-b2df-63cf9c6f46c0_TEN0_sample_210224;6;60cabc8327a131004cceb1b7;Shabby Soft Stimulating Image Human Local Difficult Truck Mixture Regal Street Rule Dirty Nose Sweaty Summer Meat Indelible Unaware Sick Luminous Exercise Personal Week Studious Funeral Path Secretary Tense Case Anguished Jolly Dim Inconsequential Coarse Substance Bold Dizzy Matter Serene Rundown Rest Society Course Pride Pleased 46;60cabc7f27a131004cceabd6;https://nftjapan.s3.ap-southeast-1.amazonaws.com/image/2cc26488-faf9-43fc-9214-da6fb8cf71b1-ep1.png;2;60cabc8c27a131004ccec0bb;24;Mon Jul 19 2021 12:53:43 GMT+0700 (Indochina Time);615989
50;Hit Envious Grab Well-informed 50;["60f6423e8947a20489a96072","60f6423e8947a20489a9607f"];read/526e9d01-592f-44c9-9669-8b9d812e731a_TEN2_sample_210224;18;60cabc8327a131004cceb1b8;Impressionable Wait Unnatural Single Spotted Exam Cut Examination Construction Limit Boot Granular Exciting Cake Feisty Log Feed Oven Peak Watchful Periodic Remove Window 50;60cabc7f27a131004cceabd6;https://nftjapan.s3.ap-southeast-1.amazonaws.com/image/a284ee5c-2323-4a50-86e9-54ff155d7d30-AriumWeb1x1.011.png;10;60cabc8c27a131004ccec0bb;0;Tue Jul 20 2021 08:18:53 GMT+0700 (Indochina Time);578799
54;Revenue Notable 54;["60f6423e8947a20489a96072","60f6423e8947a20489a9607f"];read/0401ed50-7505-4b79-9b41-527e0745a4c6_TEN1_sample_210224;21;60cabc8327a131004cceb1b9;Alarmed Pound Joint Habit Lay Friendship Tidy Recent Concept Half Guide Playful Agency Watery Ringed Woozy Insidious Hilarious Wife Back Meet Ragged Roasted Devil Possession Awareness Sugary Majestic Humble Boyfriend Brilliant Solid Sea Frozen Dazzling Bowed Performance Collar Analyst Swing Idealistic Bus Welcome Dishonest Slippery Classic Grade 54;60cabc7f27a131004cceabd6;https://nftjapan.s3.ap-southeast-1.amazonaws.com/image/17a0393f-bbff-494a-bb7d-e32f36413ced-AriumWeb1x1.031.png;9;60cabc8c27a131004ccec0bb;83;Mon Jul 19 2021 15:24:26 GMT+0700 (Indochina Time);89242
58;58;["60f6423e8947a20489a96072","60f6423e8947a20489a9607f"];read/d3c14d48-c040-455e-b2df-63cf9c6f46c0_TEN0_sample_210224;6;60cabc8327a131004cceb1ba;Illustrious Nifty Sensitive Used Other Toe Hour Handy Bleak Feature Lasting National Debate Boss Scientific Oval Dead Win Thunderous Royal Droopy Fearless Cultivated Flaky Watchful 58;60cabc7f27a131004cceabd6;https://nftjapan.s3.ap-southeast-1.amazonaws.com/image/2cc26488-faf9-43fc-9214-da6fb8cf71b1-ep1.png;5;60cabc8c27a131004ccec0bb;0;Wed Jul 21 2021 21:51:31 GMT+0700 (Indochina Time);822
62;Bad Private Enormous 62;["60f6423e8947a20489a96072","60f6423e8947a20489a9607f"];read/526e9d01-592f-44c9-9669-8b9d812e731a_TEN2_sample_210224;18;60cabc8327a131004cceb1bb;Descriptive Thorny Nurse Brief Inferior Perspective Novel Reference Consequence Humongous Trivial Evergreen Friendly Sugar Motherly Dim Physical Grave Torn Pattern Turn Self-reliant Science Trivial Knowledgeable Detail Mall Mellow Anxious Bike Responsibility Sane Bend Man True Curvy Tennis Tart Hurry Stroke Voluminous 62;60cabc7f27a131004cceabd6;https://nftjapan.s3.ap-southeast-1.amazonaws.com/image/a284ee5c-2323-4a50-86e9-54ff155d7d30-AriumWeb1x1.011.png;2;60cabc8c27a131004ccec0bb;4;Wed Jul 21 2021 19:24:45 GMT+0700 (Indochina Time);140174
66;Stock 66;["60f6423e8947a20489a96072","60f6423e8947a20489a9607f"];read/0401ed50-7505-4b79-9b41-527e0745a4c6_TEN1_sample_210224;21;60cabc8327a131004cceb1bc;Train Jovial Illegal Channel Loud Worry Inspector Knowledgeable Wasteful Astonishing Shrill Smooth Negative Blaring Sophisticated Rough Motionless Trusty Humongous Setting Some Horror Doubt Pattern Sour Fatal Airline Substantial Investment Wrathful Substance 66;60cabc7f27a131004cceabd6;https://nftjapan.s3.ap-southeast-1.amazonaws.com/image/17a0393f-bbff-494a-bb7d-e32f36413ced-AriumWeb1x1.031.png;9;60cabc8c27a131004ccec0bb;0;Mon Jul 19 2021 04:55:57 GMT+0700 (Indochina Time);7303
70;Hateful Sharp Silver 70;["60f6423e8947a20489a96072","60f6423e8947a20489a9607f"];read/d3c14d48-c040-455e-b2df-63cf9c6f46c0_TEN0_sample_210224;6;60cabc8327a131004cceb1bd;Upper International Abroad Infinite Border Belated Medium Baby Paltry Satisfied Friend Writer Economics Price Fire Hospitable Flower Test Leave Working Dear Lab Collection Chief Lanky Glamorous Criticism Impress Sizzling 70;60cabc7f27a131004cceabd6;https://nftjapan.s3.ap-southeast-1.amazonaws.com/image/2cc26488-faf9-43fc-9214-da6fb8cf71b1-ep1.png;3;60cabc8c27a131004ccec0bb;31;Tue Jul 20 2021 03:55:27 GMT+0700 (Indochina Time);124
74;Border Authentic 74;["60f6423e8947a20489a96072","60f6423e8947a20489a9607f"];read/526e9d01-592f-44c9-9669-8b9d812e731a_TEN2_sample_210224;18;60cabc8327a131004cceb1be;Monthly Careful Nice Owner Usable Detail Pair Change Perfect Extraneous Remote Perspective Drawing Funny Front Action Palatable Fall Soupy Tea Forever Substance Award Staid Code Representative Concert Spirit Stark Kind Category Delayed Detail Balance Childhood Broad Writing Quintessential Luck Agonizing Internet Clock Courageous Punch Wine Concrete 74;60cabc7f27a131004cceabd6;https://nftjapan.s3.ap-southeast-1.amazonaws.com/image/a284ee5c-2323-4a50-86e9-54ff155d7d30-AriumWeb1x1.011.png;8;60cabc8c27a131004ccec0bb;0;Tue Jul 20 2021 22:05:50 GMT+0700 (Indochina Time);44
78;Idle Wait Person 78;["60f6423e8947a20489a96072","60f6423e8947a20489a9607f"];read/0401ed50-7505-4b79-9b41-527e0745a4c6_TEN1_sample_210224;21;60cabc8327a131004cceb1bf;Host Perspective Version Dependable Thought Faint Total Screen Truck Minute Surprise Another Worrisome Expert Worker Blond Associate Exchange Traumatic Construction Burdensome Composed 78;60cabc7f27a131004cceabd6;https://nftjapan.s3.ap-southeast-1.amazonaws.com/image/17a0393f-bbff-494a-bb7d-e32f36413ced-AriumWeb1x1.031.png;4;60cabc8c27a131004ccec0bb;37;Wed Jul 21 2021 07:23:15 GMT+0700 (Indochina Time);586818
82;Fan Definite Dry Wealth 82;["60f6423e8947a20489a96072","60f6423e8947a20489a9607f"];read/d3c14d48-c040-455e-b2df-63cf9c6f46c0_TEN0_sample_210224;6;60cabc8327a131004cceb1c0;Smug Well-groomed Smoggy Hide Instruction Exciting Harmful Finding Tear Opulent Pushy Life Jaded Sour Alcohol Plane Cigarette Clumsy Baseball Welcome Son Excited Stage Knotty External Adorable Fluffy Damp Uniform 82;60cabc7f27a131004cceabd6;https://nftjapan.s3.ap-southeast-1.amazonaws.com/image/2cc26488-faf9-43fc-9214-da6fb8cf71b1-ep1.png;1;60cabc8c27a131004ccec0bb;0;Tue Jul 20 2021 11:41:41 GMT+0700 (Indochina Time);255904
86;Eat 86;["60f6423e8947a20489a96072","60f6423e8947a20489a9607f"];read/526e9d01-592f-44c9-9669-8b9d812e731a_TEN2_sample_210224;18;60cabc8327a131004cceb1c1;Room Link Forsaken Service International Voluminous Money Virtual Layer Affair Sweet Passionate Fix Current Quality Glorious Tepid Fun Intrepid Chest Amused Gifted Infatuated Task Well-informed Compassionate Guidance Silver Call Championship Sociable Net Big Standard Sand Boiling Regal Novel Positive Drink Structure Sister 86;60cabc7f27a131004cceabd6;https://nftjapan.s3.ap-southeast-1.amazonaws.com/image/a284ee5c-2323-4a50-86e9-54ff155d7d30-AriumWeb1x1.011.png;3;60cabc8c27a131004ccec0bb;67;Tue Jul 20 2021 08:53:46 GMT+0700 (Indochina Time);783
90;90;["60f6423e8947a20489a96072","60f6423e8947a20489a9607f"];read/0401ed50-7505-4b79-9b41-527e0745a4c6_TEN1_sample_210224;21;60cabc8327a131004cceb1c2;Handle Earnest Affectionate Bad Precious Short-term Grounded Difficult Mail Dare Klutzy Useless Kitchen Foundation Wide Impeccable Professional Secretary Pound Native Piercing Blind Joint Nasty Clerk Cylindrical Engine 90;60cabc7f27a131004cceabd6;https://nftjapan.s3.ap-southeast-1.amazonaws.com/image/17a0393f-bbff-494a-bb7d-e32f36413ced-AriumWeb1x1.031.png;1;60cabc8c27a131004ccec0bb;0;Wed Jul 21 2021 15:12:03 GMT+0700 (Indochina Time);32611
94;Failure Pointed 94;["60f6423e8947a20489a96072","60f6423e8947a20489a9607f"];read/d3c14d48-c040-455e-b2df-63cf9c6f46c0_TEN0_sample_210224;6;60cabc8327a131004cceb1c3;Bill Broad Stock Dishonest Competition Dutiful Reasonable Concentrate Front Distinct Blue Moist Crooked Case Category Realistic Urban Lucky Energy Gripping Hot Required Strain Oil Wealthy Negative False Payment Whole Session Concept Pop External Thick Priest Unsung Sugar Hair Original Special 94;60cabc7f27a131004cceabd6;https://nftjapan.s3.ap-southeast-1.amazonaws.com/image/2cc26488-faf9-43fc-9214-da6fb8cf71b1-ep1.png;8;60cabc8c27a131004ccec0bb;92;Wed Jul 21 2021 11:10:41 GMT+0700 (Indochina Time);6802967
98;Resist 98;["60f6423e8947a20489a96072","60f6423e8947a20489a9607f"];read/526e9d01-592f-44c9-9669-8b9d812e731a_TEN2_sample_210224;18;60cabc8327a131004cceb1c4;Meaty Talkative Practical Sex Frivolous Worried Wing Unfortunate Snow Delayed Well-documented Impress Husband Motherly Bicycle Front Voice Joyful Infantile Amusing Tooth Another Uncle Harmful Even Unique Easy-going Jovial While Pitch Bike Professional Positive Utter Vapid Frosty 98;60cabc7f27a131004cceabd6;https://nftjapan.s3.ap-southeast-1.amazonaws.com/image/a284ee5c-2323-4a50-86e9-54ff155d7d30-AriumWeb1x1.011.png;9;60cabc8c27a131004ccec0bb;0;Wed Jul 21 2021 17:02:31 GMT+0700 (Indochina Time);333
102;Juvenile Knee Handsome 102;["60f6423e8947a20489a96072","60f6423e8947a20489a9607f"];read/0401ed50-7505-4b79-9b41-527e0745a4c6_TEN1_sample_210224;21;60cabc8327a131004cceb1c5;Sour Debt Choice Loud Performance Wind Interaction Map Triangular Jubilant Lawful Consequence Dance Play Picture Improvement Hold Candle Passage Indication Rub Scarce False Run Acrobatic Naive Slice Divide 102;60cabc7f27a131004cceabd6;https://nftjapan.s3.ap-southeast-1.amazonaws.com/image/17a0393f-bbff-494a-bb7d-e32f36413ced-AriumWeb1x1.031.png;2;60cabc8c27a131004ccec0bb;10;Tue Jul 20 2021 16:50:51 GMT+0700 (Indochina Time);422
106;Coarse Hearty 106;["60f6423e8947a20489a96072","60f6423e8947a20489a9607f"];read/d3c14d48-c040-455e-b2df-63cf9c6f46c0_TEN0_sample_210224;6;60cabc8327a131004cceb1c6;Jagged Grizzled Reflecting Acclaimed Sardonic Potential Trust Chilly Attitude Essential Vain Favorable Low Impartial Rice Educated Extraneous Tubby Produce Concerned Stable Well-off Stunning Sweet Simple Wind Queasy Milky Emotion Nimble Clue Adventurous Vast Gear Profit Appointment Ratio Plastic Customer Gummy Genuine Metal Memory Chief Mix Wasteful Status 106;60cabc7f27a131004cceabd6;https://nftjapan.s3.ap-southeast-1.amazonaws.com/image/2cc26488-faf9-43fc-9214-da6fb8cf71b1-ep1.png;2;60cabc8c27a131004ccec0bb;0;Wed Jul 21 2021 00:52:00 GMT+0700 (Indochina Time);133
110;Alarmed End Warlike 110;["60f6423e8947a20489a96072","60f6423e8947a20489a9607f"];read/526e9d01-592f-44c9-9669-8b9d812e731a_TEN2_sample_210224;18;60cabc8327a131004cceb1c7;Supportive Dental Roll Fearless Preference End Insecure Anger Equatorial Female Proposal Easy-going Plump Greedy Challenge Dance Scarce Finger Poet Perfect Hearty Unused Wife Calendar Shirt Benefit Dealer Sound Difficult Purpose Buttery Pattern Dimpled Reliable Fix Pack Blank Local Precious Reach 110;60cabc7f27a131004cceabd6;https://nftjapan.s3.ap-southeast-1.amazonaws.com/image/a284ee5c-2323-4a50-86e9-54ff155d7d30-AriumWeb1x1.011.png;6;60cabc8c27a131004ccec0bb;63;Wed Jul 21 2021 11:37:06 GMT+0700 (Indochina Time);4622992
114;Forked Silly 114;["60f6423e8947a20489a96072","60f6423e8947a20489a9607f"];read/0401ed50-7505-4b79-9b41-527e0745a4c6_TEN1_sample_210224;21;60cabc8327a131004cceb1c8;Tell Union Bank Type Consideration Community Vapid Purchase Vivid High-level Tight Helpful Profile Hire Beach Brother Negative Population Tired Lanky Opinion Reception Tower Twin Youthful Vapid Dense Sentence Blind Talkative Imaginative Lovely Silver Current Police Cluttered Tax God Spiteful Average Worn 114;60cabc7f27a131004cceabd6;https://nftjapan.s3.ap-southeast-1.amazonaws.com/image/17a0393f-bbff-494a-bb7d-e32f36413ced-AriumWeb1x1.031.png;3;60cabc8c27a131004ccec0bb;0;Tue Jul 20 2021 04:57:41 GMT+0700 (Indochina Time);65394
118;Giddy Ashamed Mediocre 118;["60f6423e8947a20489a96072","60f6423e8947a20489a9607f"];read/d3c14d48-c040-455e-b2df-63cf9c6f46c0_TEN0_sample_210224;6;60cabc8327a131004cceb1c9;Safe Slight Detail Meaty Foolish Animated Traffic Personal Inflation Consist Swimming Bouncy Field Disk Visible Direct Silky Bowed Length Kaleidoscopic Border Insistent Oblong Invite Crafty Flimsy Brown Lawful Room Pass Rash Thunderous Jittery Scared Warm Introduction Distorted External Animal Short-term Tremendous Wonderful Courteous Factor Reasonable Juicy 118;60cabc7f27a131004cceabd6;https://nftjapan.s3.ap-southeast-1.amazonaws.com/image/2cc26488-faf9-43fc-9214-da6fb8cf71b1-ep1.png;4;60cabc8c27a131004ccec0bb;13;Mon Jul 19 2021 14:09:43 GMT+0700 (Indochina Time);213927
122;Give Dreary Safety Muted 122;["60f6423e8947a20489a96072","60f6423e8947a20489a9607f"];read/526e9d01-592f-44c9-9669-8b9d812e731a_TEN2_sample_210224;18;60cabc8327a131004cceb1ca;Miniature Optimistic Top Appearance Current Baby Teaching Suck Empty Rotten Mission Drab Evening Whispered Burdensome Shower Heavy Identical Refrigerator Conflict Affair Moist Brave Alarm Sex Firm Disk Brilliant Precious Virus Gleaming Strike 122;60cabc7f27a131004cceabd6;https://nftjapan.s3.ap-southeast-1.amazonaws.com/image/a284ee5c-2323-4a50-86e9-54ff155d7d30-AriumWeb1x1.011.png;1;60cabc8c27a131004ccec0bb;0;Wed Jul 21 2021 20:41:02 GMT+0700 (Indochina Time);472
126;Scarce 126;["60f6423e8947a20489a96072","60f6423e8947a20489a9607f"];read/0401ed50-7505-4b79-9b41-527e0745a4c6_TEN1_sample_210224;21;60cabc8327a131004cceb1cb;Primary Let Depth Sick Kaleidoscopic Keen Homely Plant Putrid Ambitious Negotiation Chest Win Cream Illiterate Pop Klutzy Magazine Zesty Style Complex Motherly Voluminous Warning That Hungry Touch Dark Scientific Deafening Bossy Scholarly 126;60cabc7f27a131004cceabd6;https://nftjapan.s3.ap-southeast-1.amazonaws.com/image/17a0393f-bbff-494a-bb7d-e32f36413ced-AriumWeb1x1.031.png;5;60cabc8c27a131004ccec0bb;74;Wed Jul 21 2021 20:44:30 GMT+0700 (Indochina Time);6687953
130;Historian Shocking Sympathy 130;["60f6423e8947a20489a96072","60f6423e8947a20489a9607f"];read/d3c14d48-c040-455e-b2df-63cf9c6f46c0_TEN0_sample_210224;6;60cabc8327a131004cceb1cc;Right Motionless Plastic Win Friendly Descriptive Joyous Forked Throat Professional Tender Thoughtful Advance Attractive Quick-witted Faraway Trust Severe Start Wry Sardonic Station Gift Proud Ticket Shine Rip Wicked 130;60cabc7f27a131004cceabd6;https://nftjapan.s3.ap-southeast-1.amazonaws.com/image/2cc26488-faf9-43fc-9214-da6fb8cf71b1-ep1.png;1;60cabc8c27a131004ccec0bb;0;Tue Jul 20 2021 22:30:33 GMT+0700 (Indochina Time);847
134;Arctic Department Naive Cancer 134;["60f6423e8947a20489a96072","60f6423e8947a20489a9607f"];read/526e9d01-592f-44c9-9669-8b9d812e731a_TEN2_sample_210224;18;60cabc8327a131004cceb1cd;Total Belated Girl Storage Known Expression Sweltering Tax Diligent Capital Superb Sand Virus Goal Outstanding Candid Boss Warning Theme Unfinished Spry Wine Loss Ajar Data Deserted Idea Spot Paltry Important Some Puny Female Scarce Beat Positive Plate Young Visible Intentional Lanky 134;60cabc7f27a131004cceabd6;https://nftjapan.s3.ap-southeast-1.amazonaws.com/image/a284ee5c-2323-4a50-86e9-54ff155d7d30-AriumWeb1x1.011.png;8;60cabc8c27a131004ccec0bb;6;Mon Jul 19 2021 19:37:18 GMT+0700 (Indochina Time);336990
138;Pessimistic Package 138;["60f6423e8947a20489a96072","60f6423e8947a20489a9607f"];read/0401ed50-7505-4b79-9b41-527e0745a4c6_TEN1_sample_210224;21;60cabc8327a131004cceb1ce;Attempt Car Touch Cool Icky Curly Prestigious Strange Anchored Mammoth Change Only Vacation Formal Alarmed Belt Woozy Poem Dinner Cookie Colorless Art Week Hasty Strict Goal Form Messy Hunt 138;60cabc7f27a131004cceabd6;https://nftjapan.s3.ap-southeast-1.amazonaws.com/image/17a0393f-bbff-494a-bb7d-e32f36413ced-AriumWeb1x1.031.png;4;60cabc8c27a131004ccec0bb;0;Tue Jul 20 2021 23:53:58 GMT+0700 (Indochina Time);8237
142;Marketing 142;["60f6423e8947a20489a96072","60f6423e8947a20489a9607f"];read/d3c14d48-c040-455e-b2df-63cf9c6f46c0_TEN0_sample_210224;6;60cabc8327a131004cceb1cf;Screw Breath Series Brown Natural Good Conventional Heartfelt Flippant Helpless Murky Exercise Our Concern Frank Commission Pink White Useless Sign 142;60cabc7f27a131004cceabd6;https://nftjapan.s3.ap-southeast-1.amazonaws.com/image/2cc26488-faf9-43fc-9214-da6fb8cf71b1-ep1.png;1;60cabc8c27a131004ccec0bb;73;Wed Jul 21 2021 22:42:24 GMT+0700 (Indochina Time);210
146;Favorable Escape 146;["60f6423e8947a20489a96072","60f6423e8947a20489a9607f"];read/526e9d01-592f-44c9-9669-8b9d812e731a_TEN2_sample_210224;18;60cabc8327a131004cceb1d0;Vague Sore Comment Sweaty Elevator Lead Trusty Handy Notable Equipment Island Animal Esteemed Educated Grown Highlight Far Point Regret Appropriate Radio Substantial Deafening Sturdy Maintenance Knife Sweet Conscious Audience Front Angle Politics Delectable Combine Deposit Kindhearted Storage Shallow Complicated Print Swing Shop Jumbo Competent Regular 146;60cabc7f27a131004cceabd6;https://nftjapan.s3.ap-southeast-1.amazonaws.com/image/a284ee5c-2323-4a50-86e9-54ff155d7d30-AriumWeb1x1.011.png;1;60cabc8c27a131004ccec0bb;0;Tue Jul 20 2021 21:47:18 GMT+0700 (Indochina Time);8661539
150;Detailed Mirror 150;["60f6423e8947a20489a96072","60f6423e8947a20489a9607f"];read/0401ed50-7505-4b79-9b41-527e0745a4c6_TEN1_sample_210224;21;60cabc8327a131004cceb1d1;Irritating Vacation Effective Scrawny Catch Impressive Noisy Female Shirt Script Passion Bike Meaning Safe Confused Chief String Sudden Blue Wrap Frequent Jacket Portly Ring Jacket Good-natured Ring Rich Pertinent Known Cluttered Secondary Shirt Shameless Arctic Vicious Perfect Separate Grim Tackle Scrawny Gargantuan Agreement 150;60cabc7f27a131004cceabd6;https://nftjapan.s3.ap-southeast-1.amazonaws.com/image/17a0393f-bbff-494a-bb7d-e32f36413ced-AriumWeb1x1.031.png;5;60cabc8c27a131004ccec0bb;30;Wed Jul 21 2021 10:09:30 GMT+0700 (Indochina Time);62640
154;Ratio Dream 154;["60f6423e8947a20489a96072","60f6423e8947a20489a9607f"];read/d3c14d48-c040-455e-b2df-63cf9c6f46c0_TEN0_sample_210224;6;60cabc8327a131004cceb1d2;Satisfaction Early Progress Display Potable Complicated Impeccable Spotless Specialist Buzzing Corrupt Cap Strict Present Murky Lecture Square Unwritten Reserve Remote Particular Exchange Snarling Round University Map Giant Normal Candidate Juice Vapid Current Outside Huge Chain Downright Connection Improvement Tool Flickering Industry Chubby Process Constant Tricky Plane Initiative Drink Dead 154;60cabc7f27a131004cceabd6;https://nftjapan.s3.ap-southeast-1.amazonaws.com/image/2cc26488-faf9-43fc-9214-da6fb8cf71b1-ep1.png;5;60cabc8c27a131004ccec0bb;0;Mon Jul 19 2021 18:47:43 GMT+0700 (Indochina Time);7660324
